{"type":"config","name":"Test closure_with_self_correction store_with_outcome","metricName":"test_failures","metricUnit":"","bestDirection":"lower"}
{"run":1,"commit":"ee04292","metric":1,"metrics":{},"status":"crash","description":"python command not found, crash","timestamp":1775582095007,"segment":0,"confidence":null}
{"run":2,"commit":"57f3376","metric":4,"metrics":{},"status":"keep","description":"4 test failures: library pollution from persisted state, None feedback crash","timestamp":1775582198653,"segment":0,"confidence":null}
{"run":3,"commit":"57f3376","metric":0,"metrics":{},"status":"discard","description":"Pending pytest from previous session","timestamp":1775582215026,"segment":0,"confidence":null}
{"run":4,"commit":"78e4c36","metric":1,"metrics":{},"status":"keep","description":"pending_review was not setting failure_reason for AI-assisted case","timestamp":1775582224374,"segment":0,"confidence":null}
{"run":5,"commit":"78e4c36","metric":0,"metrics":{},"status":"discard","description":"pending prior run","timestamp":1775582225976,"segment":0,"confidence":null}
{"run":6,"commit":"b564fcf","metric":0,"metrics":{},"status":"keep","description":"All 12 tests pass - store_with_outcome integrated into closure pipeline","timestamp":1775582238553,"segment":0,"confidence":null}
{"type":"config","name":"Git commit and tag v6.73","metricName":"exit_code","metricUnit":"","bestDirection":"lower"}
{"run":1,"commit":"5536636","metric":0,"metrics":{},"status":"keep","description":"Stage all changes","timestamp":1775582365067,"segment":1,"confidence":null}
{"run":2,"commit":"592c0fa","metric":0,"metrics":{},"status":"keep","description":"Check staged files","timestamp":1775582414199,"segment":1,"confidence":null}
{"run":3,"commit":"cca976d","metric":0,"metrics":{},"status":"keep","description":"Pending experiment discard","timestamp":1775582477546,"segment":1,"confidence":null}
{"run":4,"commit":"03ce0e0","metric":1,"metrics":{},"status":"keep","description":"v6.73 commit - feat: fill last 5% gaps - P0-3 cron/notifier, P0-1 MI formula, P2-3 closure learning","timestamp":1775582503621,"segment":1,"confidence":null}
{"run":5,"commit":"6838ccc","metric":0,"metrics":{},"status":"keep","description":"gog gmail list - connected, no unread emails","timestamp":1775585908492,"segment":1,"confidence":null}
